id,name,runtime,summary,year,director,language,heart,tmdb_id,tmdb_title,original_title,imdb_id,release_date,release_year,runtime_min,original_language,origin_country,production_countries,tagline,overview,genres,genre_ids,keywords,keyword_ids,tmdb_directors,writers,cast_top5,collection_name,collection_id,tmdb_rating,vote_count,popularity,budget,revenue,production_companies,poster_path,backdrop_path,poster_file,match_status
ALN001,Alien,117,A commercial crew aboard the deep space towing vessel Nostromo is awakened from their cryo-sleep to investigate a distress call from an alien world.,1979,Ridley Scott,English,Y,348,Alien,Alien,tt0078748,1979-05-25,1979,117,en,US,"United States of America, United Kingdom",In space no one can hear you scream.,"During its return to the earth, commercial spaceship Nostromo intercepts a distress signal from a distant planet. When a three-member team of the crew discovers a chamber containing thousands of eggs on the planet, a creature inside one of the eggs attacks an explorer. The entire crew is unaware of the impending nightmare set to descend upon them when the alien parasite planted inside its unfortunate host is birthed.","Horror, Science Fiction","27, 878","android, spacecraft, space marine, biology, dystopia, countdown, space suit, beheading, space travel, cowardice, alien, space, female protagonist, parasite, space opera, cosmos","803, 1612, 1826, 6016, 4565, 1825, 1828, 1829, 3801, 7956, 9951, 9882, 11322, 157634, 161176, 204390",Ridley Scott,"Dan O'Bannon, Dan O'Bannon, Ronald Shusett","Tom Skerritt, Sigourney Weaver, Veronica Cartwright, Harry Dean Stanton, John Hurt",Alien Collection,8091,8.17,16426,19.5575,11000000,104931801,"Brandywine Productions, Twentieth Century-Fox Productions, Ronald Shusett Productions",/vfrQk5IPloGg1v9Rzbh2Eg3VGyM.jpg,/AmR3JG1VQVxU8TfAvljUhfSFUOx.jpg,ALN001.jpg,matched
ALN002,The Thing,109,A research team in Antarctica is hunted by a shape-shifting alien that assumes the appearance of its victims.,1982,John Carpenter,English,Y,1091,The Thing,The Thing,tt0084787,1982-06-25,1982,109,en,US,United States of America,Anytime. Anywhere. Anyone.,A research team in Antarctica is hunted by a shape-shifting alien that assumes the appearance of its victims.,"Horror, Mystery, Science Fiction","27, 9648, 878","spacecraft, helicopter, space marine, cold, based on novel or book, isolation, mutation, paranoia, snowstorm, research station, alien life-form, alien, remake, survival, creature, helicopter pilot, antarctica, shape shifting alien, alien infection, survival horror, sled dogs, alien monster, alien parasites, isolated place, uncertainty, blood test, body horror, ambiguity, lovecraftian, distressing","1612, 720, 1826, 5198, 818, 1533, 2766, 2340, 3373, 4713, 4862, 9951, 9714, 10349, 13031, 14605, 14728, 14729, 15250, 50009, 155821, 183787, 220392, 238467, 254703, 270023, 283085, 286954, 287274, 325801",John Carpenter,Bill Lancaster,"Kurt Russell, Wilford Brimley, T.K. Carter, David Clennon, Keith David",The Thing Collection,479888,8.073,7965,11.1174,15000000,19629760,"Universal Pictures, The Turman-Foster Company",/tzGY49kseSE9QAKk47uuDGwnSCu.jpg,/r9leYNa8nTRCceZrZhP1DXkgKVb.jpg,ALN002.jpg,matched
ALN003,Annihilation,115,"A biologist signs up for a dangerous, secret expedition into a mysterious zone where the laws of nature do not apply.",2018,Alex Garland,English,Y,300668,Annihilation,Annihilation,tt2798920,2018-02-22,2018,115,en,US,"United Kingdom, United States of America",Fear what's inside.,"A biologist signs up for a dangerous, secret expedition into a mysterious zone where the laws of nature don't apply.","Science Fiction, Horror","878, 27","depression, florida, quarantine, coma, based on novel or book, mutation, self-destruction, professor, dna, expedition, transformation, alligator, hybrid, swamp, meteor, grief, physicist, cancer, memory loss, psychologist, scientist, paramedic, missing person, mourning, beast, geologist, biologist, unusual phenomena, psychedelic, speculative, meditative, compound, missing husband, fauna, mysterious life form, flora, dreary, body horror, lovecraftian, psychological horror, absurd, ambiguous","894, 1196, 6898, 732, 818, 2766, 1824, 1992, 1718, 1963, 4375, 3184, 9410, 4551, 5404, 9872, 8012, 10163, 11469, 11268, 14760, 41603, 156091, 159103, 161271, 161281, 161294, 161348, 184392, 190531, 197056, 201137, 208364, 238997, 242920, 243655, 261264, 283085, 287274, 295907, 309974, 325763",Alex Garland,Alex Garland,"Natalie Portman, Jennifer Jason Leigh, Gina Rodriguez, Tessa Thompson, Tuva Novotny",,,6.441,9382,7.5568,40000000,43070915,"Paramount Pictures, Skydance Media, DNA Films, Scott Rudin Productions",/4YRplSk6BhH6PRuE9gfyw9byUJ6.jpg,/9trZvBr44UGedUOiGo3jgSUw13e.jpg,ALN003.jpg,matched
ALN004,V/H/S/Beyond,114,"An anthology of six frightening encounters caught on video camera, where other-worldly creatures invade and terrorise humans.",2024,"Jay Cheel, Jordan Downey, Christian Long, Justin Long, Justin Martinez, Virat Pal, Kate Siegel",English,,1190868,V/H/S/Beyond,V/H/S/Beyond,tt32880932,2024-09-20,2024,114,en,US,"United States of America, United Arab Emirates",No safe space.,"The infinite playground of forbidden worlds and dangerous lifeforms offered by the sci-fi horror genre will lead to the biggest, maddest, bloodiest V/H/S ever.","Horror, Science Fiction, Thriller","27, 878, 53","anthology, sequel, alien, ufo, zombie, india, alien invasion, found footage, portmanteau, sky diving, horror anthology, pseudo-documentary","9706, 9663, 9951, 9738, 12377, 14636, 14909, 163053, 208891, 229219, 250593, 276164","Jordan Downey, Justin Long, Christian Long, Kate Siegel, Virat Pal, Justin Martinez, Jay Cheel","Justin Long, Mike Flanagan, Justin Martinez, Christian Long, Virat Pal, Evan Dickson, Ben Turner, Ben Turner, Kevin Stewart, Jordan Downey","Brian Baker, Trevor Dow, Gerry Eng, Sam Gorski, Mitch Horowitz",V/H/S Collection,207621,6.57,302,1.7562,,,"Bloody Disgusting, Shudder, Cinepocalypse, Studio71, Spooky Pictures, Image Nation Abu Dhabi",/wXaf6VGNHIGU7qivapGOF7o4o4N.jpg,/kB7Eo8fjyHn4a80A2WUfW6YiMPG.jpg,ALN004.jpg,matched (manual)
ALN005,Sputnik,113,"Summoned to a secluded research facility at the height of the Cold War, a controversial young doctor examines a cosmonaut who may not have returned to Earth alone.",2020,Egor Abramenko,Russian,,594718,Sputnik,Спутник,tt11905962,2020-07-24,2020,113,ru,RU,Russia,The only survivor did not come back alone.,"At the height of the Cold War, a Soviet spacecraft crash lands after a mission gone awry, leaving the commander as its only survivor. After a renowned Russian psychologist is brought in to evaluate the commander’s mental state, it becomes clear that something dangerous may have come back to Earth with him…","Science Fiction, Drama, Horror","878, 18, 27","spacecraft, alien life-form, alien, murder, doctor, cosmonaut, spacecraft accident, alien creature, symbiotic, based on short film","1612, 4862, 9951, 9826, 13005, 198136, 226236, 230857, 233169, 268132",Egor Abramenko,"Oleg Malovichko, Andrey Zolotarev","Oksana Akinshina, Fyodor Bondarchuk, Pyotr Fyodorov, Anton Vasilyev, Aleksey Demidov",,,6.543,983,3.1553,2600000,354023,"Vodorod Film Company, Art Pictures Studio, Hype Film, NMG Studio, Cinema Foundation of Russia",/eAUzmhP54bE1vPXaY7FbuZREJlR.jpg,/90Hjx5iXwNRIqm3MvgYMKNuHoQe.jpg,ALN005.jpg,matched
ALN006,Dark Skies,97,"As the Barrett family's peaceful suburban life is rocked by an escalating series of disturbing events, they come to learn that a terrifying and deadly force is after them, one which may have arrived from beyond the stars.",2013,Scott Stewart,English,,145135,Dark Skies,Dark Skies,tt2387433,2013-02-21,2013,97,en,US,United States of America,Once you have been chosen. You belong to them.,"From the producers of Paranormal Activity, Insidious, and Sinister comes Dark Skies: a supernatural thriller that follows a young family living in the suburbs. As husband and wife Daniel and Lacey Barret witness an escalating series of disturbing events involving their family, their safe and peaceful home quickly unravels. When it becomes clear that the Barret family is being targeted by an unimaginably terrifying and deadly force, Daniel and Lacey take matters in their own hands to solve the mystery of what is after their family.","Science Fiction, Thriller, Horror","878, 53, 27","blackout, alien, alien abduction, fear, home invasion, family, fourth of july, mysterious, mysterious events, suspenseful, sci-fi horror","2583, 9951, 12553, 13073, 14903, 18035, 159743, 197582, 238137, 314730, 323910",Scott Stewart,Scott Stewart,"Keri Russell, Josh Hamilton, Dakota Goyo, J.K. Simmons, Trevor St. John",,,6.35,1951,9.0961,3500000,27858103,"Cinema Vehicle Services, Alliance Films, Automatik Entertainment, Blumhouse Productions",/euLgEo2kvuLjYxbfOekWF3l82t6.jpg,/oLuAgHcYk9UrulfFJCmYfcnvmgB.jpg,ALN006.jpg,matched
ALN007,Fire in the Sky,109,An Arizona logger mysteriously disappears for five days in an alleged encounter with a flying saucer in 1975. His co-workers endure ridicule and contempt as they are wrongly accused of murder.,1993,Robert Lieberman,English,,15613,Fire in the Sky,Fire in the Sky,tt0106912,1993-03-12,1993,109,en,US,United States of America,"Alien abduction. November 5, 1975. White Mountains, Northeastern Arizona.","After clearing brush for the government, a group of men return to town claiming their friend was abducted. Despite no apparent motive or evidence of foul play, no-one believes their story and his disappearance is treated as murder.","Science Fiction, Mystery, Thriller, Drama","878, 9648, 53, 18","small town, based on novel or book, police, arizona, biography, based on true story, woods, alien, ufo, extraterrestrial, alien abduction, search party, media coverage, logger, kidnapped","1415, 818, 6149, 1859, 5565, 9672, 9720, 9951, 9738, 9739, 12553, 169962, 181105, 188334, 291004",Rob Lieberman,Tracy Tormé,"D. B. Sweeney, Robert Patrick, Craig Sheffer, Peter Berg, Henry Thomas",,,6.7,700,5.1717,15000000,19885552,"Paramount Pictures, Joe Wizan/Todd Black",/rTFrjAp1YV49DSTUGCyKSkaEHC8.jpg,/rG8rGUrK3Ur6N2DuTVvjrtpV44l.jpg,ALN007.jpg,matched (manual)
ALN008,The Phoenix Tapes '97,67,"During the Phoenix Lights in 1997, four campers go missing and are never found.",2016,Turner Clay,English,,419825,The Phoenix Tapes '97,The Phoenix Tapes '97,tt9036998,2016-09-26,2016,67,en,"CA, US",Canada,,"In 1997, four campers went missing during the Phoenix Lights incident and their bodies were never found. The Phoenix Tapes 97 is comprised of their final footage. This film is dedicated to the lives lost during the events displayed. To their families and friends and to the authorities who continue to search for answers. ​ The tapes were found by Dustin Miller's father two years after Dustin was mysteriously shot and killed at a traffic stop in Texas. Peter Miller believes his son was acting as a whistleblower and had smuggled the tapes from his classified government agency in an effort to expose the truth as to what really happened to the four missing campers seen in the tapes. ​ After searching every newspaper and media publication around Phoenix during that time period, we only found one initial announcement that four campers were reported missing, as well as a formal police report folder with local PD but the folder had no files inside.","Horror, Science Fiction, Thriller","27, 878, 53","ufo, found footage, alien space craft, government conspiracy, ufo conspiracy, ufo sighting, alien spaceship, pseudo-documentary, ufos","9738, 163053, 177178, 181635, 206212, 223550, 251829, 276164, 357823",Turner Clay,,"Turner Clay, Peter Miller",,,6.559,51,0.42,,,Phoenix Tapes Foundation,/pcBro07U8hARvconcYHJAQGz50J.jpg,/1C4E4r0OmRIHWLhK3CLPvFZZ5Ps.jpg,ALN008.jpg,matched
ALN009,Phoenix Forgotten,87,"Two decades after three teenagers disappeared in the wake of mysterious lights appearing above Phoenix, Arizona, unseen footage from that night has been discovered, chronicling the final hours of their fateful expedition.",2017,Justin Barber,English,,443319,Phoenix Forgotten,Phoenix Forgotten,tt6574272,2017-04-21,2017,87,en,US,"United Kingdom, United States of America","Based on Shocking, Untold True Events.","Twenty years after three teenagers disappeared in the wake of mysterious lights appearing above Phoenix, Arizona, unseen footage from that night has been discovered, chronicling the final hours of their fateful expedition.","Horror, Mystery, Science Fiction","27, 9648, 878","alien, found footage, aliens, pseudo-documentary, faux documentary","9951, 163053, 273439, 276164, 365784",Justin Barber,"T.S. Nowlin, Justin Barber","Florence Hartigan, Luke Spencer Roberts, Chelsea Lopez, Justin Matthews, Clint Jordan",,,6.2,336,1.6679,2800000,3600000,"Cinelou Films, The Fyzz Facility, Atmosphere Entertainment MM, Scott Free Productions",/q0BbjmTPSqF1QnZxHNc1GQ4JIHc.jpg,/vk0msqGGhttTQJKnojFffc3nbe1.jpg,ALN009.jpg,matched
ALN010,Aliens: Zone of Silence,79,"After Morgan's brother Hal vanishes from the Mexican desert, Morgan sets out to uncover the truth about his disappearance. When she discovers an extraterrestrial presence, she must risk her life to expose the desert's otherworldly secret.",2017,Andy Fowler,English,,483006,Aliens: Zone of Silence,Aliens: Zone of Silence,tt3604156,2017-10-24,2017,79,en,US,United States of America,You Are Not Alone.,"After her brother mysteriously vanishes from the Mexican desert, a young woman sets out to uncover the otherworldly truth about his disappearance.","Horror, Mystery, Science Fiction","27, 9648, 878","alien, disappearance, alien invasion, desert, found footage, supernatural power, aliens","9951, 10941, 14909, 18034, 163053, 251513, 273439",Andy Fowler,"Fidel Arizmendi, Andy Fowler","Sarah Hester, Peter Gesswein, Jed Maheu, Vince Tula, Marcos Cline-Márquez",,,4.5,23,0.114,,,"Altered L.A., Punch Media",/rvtlCZYoNvLVUBchWottgOvemhv.jpg,/n1iJg0rD8NCtyywyNsEkV9Bp8R8.jpg,ALN010.jpg,matched
ALN011,Ick,93,"An unlucky high school science teacher, a sarcastic student, and her mother must deal with a parasitic alien entity known as ""The Ick"" that is encroaching upon their small town.",2024,Joseph Kahn,English,,1218493,Ick,Ick,tt31795447,2025-07-27,2025,93,en,US,"United States of America, United Kingdom, United Arab Emirates",Don't touch.,Science teacher Hank’s life changes when he reconnects with his first love and suspects that a new student may be his daughter—all while facing an alien threat in their town.,"Horror, Science Fiction","27, 878","alien, alien invasion","9951, 14909",Joseph Kahn,"Samuel Laskey, Joseph Kahn, Dan Koontz","Brandon Routh, Malina Weissman, Harrison Cone, Taia Sophia, Zeke Jones",,,6.091,44,1.3456,,,"Interstellar Entertainment, Room 101, AGC Studios, Stone Buffalo Entertainment, Amongst Giants, Sinister Studios, Image Nation Abu Dhabi",/AtfV5Rl0YHtibZWuwC9ilHcHugU.jpg,/mow3uFuLiBMXq5C7CzHc9wmYnDB.jpg,ALN011.jpg,matched
ALN012,Psycho Goreman ,95,"After unearthing a gem that controls an evil monster looking to destroy the Universe, a young girl and her brother use it to make him do their bidding.",2020,Steven Kostanski,English,,670428,PG: Psycho Goreman,PG: Psycho Goreman,tt11252440,2020-09-11,2020,95,en,CA,Canada,Little girl. Big psycho.,"Siblings Mimi and Luke unwittingly resurrect an ancient alien overlord. Using a magical amulet, they force the monster to obey their childish whims, and accidentally attract a rogues’ gallery of intergalactic assassins to small-town suburbia.","Science Fiction, Comedy, Horror","878, 35, 27","monster, suburbia, alien, duringcreditsstinger","1299, 10532, 9951, 179431",Steven Kostanski,Steven Kostanski,"Nita-Josee Hanna, Owen Myre, Matthew Ninaber, Steven Vlahos, Adam Brooks",,,6.026,436,2.58,1700000,95384,"Dystopia Films, Raven Banner Entertainment, PurpleDOG",/28Y3pxfkRZMhLsw4if6e3J0HD7Q.jpg,/aLDQl8iUzrapHOob3VHgmyX1ijj.jpg,ALN012.jpg,matched
ALN013,No One Will Save You,93,Brynn finds solace within the walls of the home where she grew up until she's awakened one night by strange noises from unearthly intruders.,2023,Brian Duffield,English,,820609,No One Will Save You,No One Will Save You,tt14509110,2023-09-21,2023,93,en,US,United States of America,A home invasion no one saw coming.,A lonely woman battles extraterrestrials who threaten her future while forcing her to face her past.,"Horror, Science Fiction","27, 878","isolation, trauma, grief, female protagonist, alien abduction, home invasion, guilt, death of mother, isolated house, alien attack, cosmic horror, reclusive, sci-fi horror, admiring, audacious, frightened, social exclusion, paranormal threat, extraterrestrial encounter","1533, 2754, 9872, 11322, 12553, 14903, 33720, 157213, 172658, 192962, 215959, 255617, 323910, 325761, 325773, 325818, 339906, 372041, 374288",Brian Duffield,Brian Duffield,"Kaitlyn Dever, Elizabeth Kaluev, Zack Duhame, Lauren L. Murray, Geraldine Singer",,,6.697,1481,5.2222,22800000,,"20th Century Studios, Star Thrower Entertainment",/ehGIDAMaYy6Eg0o8ga0oqflDjqW.jpg,/zYlgqIpqJ1VAbvFhRhktAzIybVs.jpg,ALN013.jpg,matched
ALN014,Event Horizon,96,"In 2047, a rescue crew is sent to investigate the long-lost starship Event Horizon, which has mysteriously reappeared after vanishing seven years earlier — and something sinister has taken over its corridors.",1997,Paul W.S. Anderson,English,,8413,Event Horizon,Event Horizon,tt0119081,1997-08-15,1997,96,en,"US, GB","United Kingdom, United States of America",Infinite space. Infinite terror.,"In 2047, a group of astronauts are sent to investigate and salvage the starship Event Horizon which disappeared mysteriously seven years before on its maiden voyage. However, it soon becomes evident that something sinister resides in its corridors.","Horror, Science Fiction, Mystery","27, 878, 9648","space marine, nightmare, insanity, delusion, hallucination, space travel, cryogenics, gore, black hole, crew, flashback, evil spirit, alternate dimension, hellgate, religion, explosion, burning man, rescue team, super power, trapped in space, distress signal, 2040s, spaceship, lovecraftian","1826, 3030, 6255, 6262, 3298, 3801, 3385, 10292, 4380, 8468, 9856, 10114, 9820, 10135, 11001, 14601, 14888, 18031, 33637, 191586, 223504, 243676, 252937, 287274",Paul W. S. Anderson,Philip Eisner,"Laurence Fishburne, Sam Neill, Kathleen Quinlan, Joely Richardson, Richard T. Jones",,,6.583,3299,7.8994,60000000,26700000,"Impact Pictures, Paramount Pictures, Golar Productions, Lawrence Gordon Productions",/qfluaDXv0cIdLwgQWzNB2piHL2q.jpg,/nByMcYBhChTs2TF9fEFcTSsjme5.jpg,ALN014.jpg,matched (manual)
ALN015,Nope,130,"In the remote California desert, a brother and sister who wrangle horses for Hollywood productions discover that a mysterious presence lurking in the skies above their ranch is responsible for a series of disturbing disappearances.",2022,Jordan Peele,English,Y,762504,Nope,Nope,tt10954984,2022-07-20,2022,130,en,US,United States of America,What’s a bad miracle?,"Residents in a lonely gulch of inland California bear witness to an uncanny, chilling discovery.","Horror, Science Fiction","27, 878","california, exploitation, death of father, alien, ufo, social commentary, alien invasion, alien contact, aftercreditsstinger, horse farm, african american man, racial issues, brother sister relationship, horror western, psychological horror, sci-fi horror, sci-fi western","387, 2804, 10201, 9951, 9738, 11479, 14909, 160515, 179430, 197401, 199692, 204173, 240485, 279115, 295907, 323910, 351222",Jordan Peele,Jordan Peele,"Daniel Kaluuya, Keke Palmer, Brandon Perea, Michael Wincott, Steven Yeun",,,6.823,4918,7.8922,68000000,171932082,"Universal Pictures, Monkeypaw Productions",/AcKVlWaNVVVFQwro3nLXqPljcYA.jpg,/yRutvYkM3OP8N9oqqfjSK1VC7fs.jpg,ALN015.jpg,matched
ALN016,Pitch Black,109,"When a transport ship crash-lands on a barren planet, the survivors soon discover that escaped convict Riddick isn't the only danger — deadly creatures hunt in the dark, and the planet is about to plunge into total eclipse.",2000,David Twohy,English,,2787,Pitch Black,Pitch Black,tt0134847,2000-02-18,2000,108,en,US,United States of America,Don't be afraid of the dark. Be afraid of what's in the dark,"When their ship crash-lands on a remote planet, the marooned passengers soon learn that escaped convict Riddick isn't the only thing they have to fear. Deadly creatures lurk in the shadows, waiting to attack in the dark, and the planet is rapidly plunging into the utter blackness of a total eclipse. With the body count rising, the doomed survivors are forced to turn to Riddick with his eerie eyes to guide them through the darkness to safety. With time running out, there's only one rule: Stay in the light.","Thriller, Science Fiction, Action","53, 878, 28","darkness, dystopia, comet, alien life-form, survival, creature, eclipse, flask, spaceship crash, intense","3762, 4565, 4803, 4862, 10349, 13031, 14773, 14774, 237591, 321464",David Twohy,"Jim Wheat, Ken Wheat, David Twohy, Ken Wheat, Jim Wheat","Vin Diesel, Radha Mitchell, Cole Hauser, Lewis Fitz-Gerald, Claudia Black",The Chronicles of Riddick Collection,2794,6.868,4812,3.7713,23000000,53187659,Interscope Communications,/3AnlxZ5CZnhKKzjgFyY6EHxmOyl.jpg,/bMJdVmo6QqoUHpUsjWyei6MN02x.jpg,ALN016.jpg,matched
